[
  {"path":"src/sdk/orders/client.py","production_source":true,"test":false,"capability":"orders","classification_reason":"orders SDK client","expected_findings":[]},
  {"path":"src/sdk/orders/models.py","production_source":true,"test":false,"capability":"orders","classification_reason":"orders SDK models","expected_findings":[]},
  {"path":"src/sdk/billing/client.py","production_source":true,"test":false,"capability":"billing","classification_reason":"billing SDK client","expected_findings":[]},
  {"path":"src/sdk/billing/models.py","production_source":true,"test":false,"capability":"billing","classification_reason":"billing SDK models","expected_findings":[]},
  {"path":"src/sdk/common/errors.py","production_source":true,"test":false,"capability":"shared","classification_reason":"shared SDK errors","expected_findings":[]},
  {"path":"config/endpoints.json","production_source":true,"test":false,"capability":"orders","classification_reason":"behavioral endpoint registry","expected_findings":[]},
  {"path":"src/sdk/orders/tests/test_client.py","production_source":false,"test":true,"capability":"orders","classification_reason":"colocated SDK test","expected_findings":[]},
  {"path":"mapped_tests/billing/test_client.py","production_source":false,"test":true,"capability":"billing","classification_reason":"mapped SDK test root","expected_findings":[]},
  {"path":"src/sdk/orders/contest.py","production_source":false,"test":false,"capability":"","classification_reason":"contest helper is a deceptive non-test decoy","expected_findings":[]},
  {"path":"docs/specification.md","production_source":false,"test":false,"capability":"","classification_reason":"prose specification","expected_findings":[]},
  {"path":"vendor/generated_sdk.py","production_source":false,"test":false,"capability":"","classification_reason":"vendored generated SDK artifact","expected_findings":[]},
  {"path":"docs/readme.md","production_source":false,"test":false,"capability":"","classification_reason":"ordinary library documentation","expected_findings":[]}
]
