[
  {"path":"app/controllers/orders/create.py","production_source":true,"test":false,"capability":"orders","classification_reason":"layered orders controller","expected_findings":[]},
  {"path":"app/services/orders/service.py","production_source":true,"test":false,"capability":"orders","classification_reason":"layered orders service","expected_findings":[]},
  {"path":"app/models/orders/model.py","production_source":true,"test":false,"capability":"orders","classification_reason":"layered orders model","expected_findings":[]},
  {"path":"app/controllers/billing/create.py","production_source":true,"test":false,"capability":"billing","classification_reason":"layered billing controller","expected_findings":[]},
  {"path":"app/shared/db.py","production_source":true,"test":false,"capability":"shared","classification_reason":"shared database support","expected_findings":[]},
  {"path":"config/orders/routing.toml","production_source":true,"test":false,"capability":"orders","classification_reason":"behavioral orders routing","expected_findings":[]},
  {"path":"app/services/orders/tests/test_service.py","production_source":false,"test":true,"capability":"orders","classification_reason":"colocated layered orders test","expected_findings":[]},
  {"path":"tests/integration/test_billing.py","production_source":false,"test":true,"capability":"billing","classification_reason":"mapped integration billing test","expected_findings":[]},
  {"path":"app/services/orders/contest.py","production_source":false,"test":false,"capability":"","classification_reason":"contest module is a deceptive non-test decoy","expected_findings":[]},
  {"path":"docs/specification.md","production_source":false,"test":false,"capability":"","classification_reason":"prose specification","expected_findings":[]},
  {"path":"build/generated.py","production_source":false,"test":false,"capability":"","classification_reason":"generated build artifact","expected_findings":[]},
  {"path":"docs/runbook.md","production_source":false,"test":false,"capability":"","classification_reason":"ordinary runbook documentation","expected_findings":[]}
]
